{
  "id": "9ABCDEF1234567",
  "hidden": true,
  "available": true,
  "autoManage": true,
  "itemGroup": {},
  "options": [],
  "name": "Example name",
  "alternateName": "Example alternateName",
  "code": "ABC123",
  "sku": "SKU-001",
  "price": 1099,
  "priceType": "FIXED",
  "defaultTaxRates": true,
  "unitName": "Example unitName",
  "cost": 1099,
  "isRevenue": true,
  "stockCount": 1,
  "taxRates": [],
  "modifierGroups": [],
  "categories": [],
  "tags": [],
  "canonical": {},
  "itemStock": {},
  "MenuItem": {},
  "modifiedTime": 1718153645000,
  "deletedTime": 1718153645000,
  "priceWithoutVat": 1099,
  "colorCode": "ABC123"
}